{
  "$schema": "./stage_schema.json",
  "version": "0.1.0",
  "description": "아르카나 수비대 24스테이지 정의(5차). 챕터 1 = 03 §1.3 표 그대로, 2~4장 = 03 §1.2 배수, 모드 배정 = 14 §2.2, RTS 목표 = 14 §2.4, 별 = 03 §3.1 + 14 §1.1 + 10 §3. 적 HP는 런타임에 BALANCE.enemies × rules.waveHpMult × rules.challengeTierHpMult로 계산한다.",
  "rules": {
    "waveHpMult": [1, 1.6, 2.4, 3.4, 5.0],
    "challengeTierHpMult": {"1": 0.85, "2": 1.0, "3": 1.2},
    "fm": {"normal": 1.0, "fast": 0.7, "tank": 3.0, "stray": 0.5},
    "bossHp": {
      "balanceKey": "enemies.boss.hp",
      "fmRef": 16,
      "note": "왕 HP = BALANCE.enemies.boss.hp × (bossSpawn.fm ÷ fmRef) × waveHpMult[4] × challengeTierHpMult. fmRef 16 = 1-6의 왕 FM (잠정, 15 변경 제안 참조)"
    },
    "chapters": [
      {
        "chapter": 1,
        "countMult": 1.0,
        "kingFmMult": 1.0,
        "intervalMult": 1.0,
        "enemySpeedMult": 1.0,
        "slots": 6,
        "sigma": 1.0
      },
      {
        "chapter": 2,
        "countMult": 1.25,
        "kingFmMult": 1.25,
        "intervalMult": 0.95,
        "enemySpeedMult": 1.05,
        "slots": 6,
        "sigma": 1.1
      },
      {
        "chapter": 3,
        "countMult": 1.55,
        "kingFmMult": 1.6,
        "intervalMult": 0.9,
        "enemySpeedMult": 1.1,
        "slots": 7,
        "sigma": 1.2
      },
      {
        "chapter": 4,
        "countMult": 1.9,
        "kingFmMult": 2.0,
        "intervalMult": 0.88,
        "enemySpeedMult": 1.15,
        "slots": 8,
        "sigma": 1.3
      }
    ],
    "generation": "챕터 2~4 = ceil(챕터 1 수 × countMult), 간격 = 챕터 1 간격 × intervalMult(0.1초 단위 반올림, 간격 0인 단발 그룹이 2마리 이상이 되면 6.0초를 기준으로), 시작 오프셋 유지, 왕 FM = 챕터 1 × kingFmMult. RTS 스테이지는 위 결과의 길 위 FM(왕 포함)을 ×0.9로 맞추고(속삭임·안개 조각 수로 조정, 침묵 덩어리 수 유지) 이탈 안개(stray)를 별도 추가.",
    "rtsRoadFmMult": 0.9,
    "slotIndexConvention": "slotsEnabled의 숫자 = 08 §3 각 장의 '슬롯:' 목록 순서(0부터). 예) 1장 0=(3,4)고 … 9=(7,15)저",
    "modes": {
      "defense": {
        "label": "수비",
        "hero": "none",
        "orbs": false,
        "restSec": 5,
        "strayEnemies": false,
        "veil": false,
        "mapTiles": ["S", "T", "=", "o", "."],
        "heroStarRule": null,
        "perkPool": "base24",
        "swarmVisual": [3, 4]
      },
      "hero": {
        "label": "영웅",
        "hero": "semi",
        "orbs": true,
        "restSec": 8,
        "strayEnemies": false,
        "veil": false,
        "mapTiles": ["S", "T", "=", "o", ".", "x", "P"],
        "heroStarRule": "star3_fallsMax2",
        "perkPool": "base24+E4",
        "swarmVisual": [2, 2]
      },
      "rts": {
        "label": "작전",
        "hero": "semi",
        "orbs": true,
        "restSec": 8,
        "strayEnemies": true,
        "veil": "per-stage",
        "mapTiles": ["S", "T", "=", "o", ".", "x", "P", "X", "G", "R", "C", "B"],
        "heroStarRule": "star3_fallsMax2",
        "perkPool": "base24+E4",
        "swarmVisual": [1, 1]
      }
    }
  },
  "stages": [
    {
      "id": "1-1",
      "chapter": 1,
      "index": 1,
      "mode": "defense",
      "mapId": 1,
      "challengeTier": 2,
      "restSec": 5,
      "enemySpeedMult": 1.0,
      "waves": [
        {
          "wave": 1,
          "enemies": [{"type": "normal", "count": 4, "intervalSec": 4.0, "startSec": 0}],
          "boss": false,
          "bossSpawn": null,
          "fm": 4.0
        },
        {
          "wave": 2,
          "enemies": [{"type": "normal", "count": 6, "intervalSec": 3.5, "startSec": 0}],
          "boss": false,
          "bossSpawn": null,
          "fm": 6.0
        },
        {
          "wave": 3,
          "enemies": [{"type": "normal", "count": 8, "intervalSec": 3.0, "startSec": 0}],
          "boss": false,
          "bossSpawn": null,
          "fm": 8.0
        },
        {
          "wave": 4,
          "enemies": [{"type": "normal", "count": 11, "intervalSec": 2.5, "startSec": 0}],
          "boss": false,
          "bossSpawn": null,
          "fm": 11.0
        },
        {
          "wave": 5,
          "enemies": [{"type": "normal", "count": 10, "intervalSec": 2.2, "startSec": 0}],
          "boss": true,
          "bossSpawn": {"startSec": 8, "fm": 10.0},
          "fm": 20.0
        }
      ],
      "slotsEnabled": [0, 4, 5, 7, 8, 9],
      "heroEnabled": false,
      "rtsObjective": null,
      "rtsSecondary": [],
      "veil": false,
      "mapOverlay": null,
      "tutorialProtection": null,
      "tutorialScript": [
        {
          "step": 1,
          "countsAsStep": true,
          "trigger": {"kind": "firstWrong", "value": null},
          "highlight": "sealCardIcon",
          "text": "틀린 건 봉인돼요",
          "pass": {"kind": "dismiss", "value": null},
          "stuckHelp": null
        }
      ],
      "starThresholds": {
        "star1": {"towerSurvives": true, "minCorrect": 8},
        "star2": {"minTowerHp": 6, "minAccuracy": 0.6, "maxLeaks": null, "minCartLight": null, "minBeaconsLit": null},
        "star3": {
          "minTowerHp": 9,
          "minAccuracy": 0.8,
          "minMaxCombo": 5,
          "maxFalls": null,
          "maxLeaks": null,
          "minCartLight": null,
          "minBeaconsLit": null
        }
      },
      "design": {
        "fmRoad": 49.0,
        "fmStray": 0.0,
        "fm03": 49,
        "r70": 0.35,
        "questions03": 23,
        "guaranteedAnswers": 23,
        "densityTarget": 7.5,
        "densityFloor": null
      }
    },
    {
      "id": "1-2",
      "chapter": 1,
      "index": 2,
      "mode": "defense",
      "mapId": 1,
      "challengeTier": 2,
      "restSec": 5,
      "enemySpeedMult": 1.0,
      "waves": [
        {
          "wave": 1,
          "enemies": [{"type": "normal", "count": 5, "intervalSec": 3.5, "startSec": 0}],
          "boss": false,
          "bossSpawn": null,
          "fm": 5.0
        },
        {
          "wave": 2,
          "enemies": [
            {"type": "fast", "count": 6, "intervalSec": 3.0, "startSec": 0},
            {"type": "normal", "count": 5, "intervalSec": 3.5, "startSec": 0}
          ],
          "boss": false,
          "bossSpawn": null,
          "fm": 9.2
        },
        {
          "wave": 3,
          "enemies": [
            {"type": "fast", "count": 8, "intervalSec": 2.6, "startSec": 0},
            {"type": "normal", "count": 7, "intervalSec": 3.0, "startSec": 0}
          ],
          "boss": false,
          "bossSpawn": null,
          "fm": 12.6
        },
        {
          "wave": 4,
          "enemies": [
            {"type": "fast", "count": 10, "intervalSec": 2.3, "startSec": 0},
            {"type": "normal", "count": 9, "intervalSec": 2.8, "startSec": 0}
          ],
          "boss": false,
          "bossSpawn": null,
          "fm": 16.0
        },
        {
          "wave": 5,
          "enemies": [
            {"type": "fast", "count": 8, "intervalSec": 2.1, "startSec": 0},
            {"type": "normal", "count": 8, "intervalSec": 2.6, "startSec": 0}
          ],
          "boss": true,
          "bossSpawn": {"startSec": 8, "fm": 11.0},
          "fm": 24.6
        }
      ],
      "slotsEnabled": [0, 4, 5, 7, 8, 9],
      "heroEnabled": false,
      "rtsObjective": null,
      "rtsSecondary": [],
      "veil": false,
      "mapOverlay": null,
      "tutorialProtection": null,
      "tutorialScript": [
        {
          "step": 1,
          "countsAsStep": true,
          "trigger": {"kind": "stageStart", "value": null},
          "highlight": "cardCup",
          "text": "컵은 안개를 늦춰요",
          "pass": {"kind": "dismiss", "value": null},
          "stuckHelp": null
        },
        {
          "step": 2,
          "countsAsStep": true,
          "trigger": {"kind": "waveStart", "value": 2},
          "highlight": "enemyFast",
          "text": "빠른 속삭임이 와요",
          "pass": {"kind": "observe", "value": 3},
          "stuckHelp": null
        }
      ],
      "starThresholds": {
        "star1": {"towerSurvives": true, "minCorrect": 8},
        "star2": {"minTowerHp": 6, "minAccuracy": 0.6, "maxLeaks": null, "minCartLight": null, "minBeaconsLit": null},
        "star3": {
          "minTowerHp": 9,
          "minAccuracy": 0.8,
          "minMaxCombo": 5,
          "maxFalls": null,
          "maxLeaks": null,
          "minCartLight": null,
          "minBeaconsLit": null
        }
      },
      "design": {
        "fmRoad": 67.4,
        "fmStray": 0.0,
        "fm03": 67,
        "r70": 0.49,
        "questions03": 23,
        "guaranteedAnswers": 23,
        "densityTarget": 7.5,
        "densityFloor": null
      }
    },
    {
      "id": "1-3",
      "chapter": 1,
      "index": 3,
      "mode": "hero",
      "mapId": 1,
      "challengeTier": 2,
      "restSec": 8,
      "enemySpeedMult": 1.0,
      "waves": [
        {
          "wave": 1,
          "enemies": [{"type": "normal", "count": 5, "intervalSec": 3.4, "startSec": 0}],
          "boss": false,
          "bossSpawn": null,
          "fm": 5.0
        },
        {
          "wave": 2,
          "enemies": [
            {"type": "fast", "count": 7, "intervalSec": 2.8, "startSec": 0},
            {"type": "normal", "count": 6, "intervalSec": 3.0, "startSec": 0}
          ],
          "boss": false,
          "bossSpawn": null,
          "fm": 10.9
        },
        {
          "wave": 3,
          "enemies": [
            {"type": "fast", "count": 10, "intervalSec": 2.3, "startSec": 0},
            {"type": "normal", "count": 10, "intervalSec": 2.8, "startSec": 0}
          ],
          "boss": false,
          "bossSpawn": null,
          "fm": 17.0
        },
        {
          "wave": 4,
          "enemies": [
            {"type": "fast", "count": 12, "intervalSec": 2.0, "startSec": 0},
            {"type": "normal", "count": 12, "intervalSec": 2.5, "startSec": 0}
          ],
          "boss": false,
          "bossSpawn": null,
          "fm": 20.4
        },
        {
          "wave": 5,
          "enemies": [